{"active_behavior_authorization":false,"cell_counts":{"behavior_distinctness_unknown":0,"capability_pending":0,"configured":2,"deduplicated":0,"expected_effective":2,"potential_execution":2,"rejected":0,"retained_for_verification":0,"structurally_inactive":0},"content_sha256":"8201064018f901e5a1340593aaa36aec3d7363c03f32122f841429b0db2aa286","document_id":"validation.experiment_plan.queued_send.actuation.v1","document_version":3,"equivalence_groups":[{"equivalence_group_id":"equivalence.9076bb71363f2b6a","equivalence_state":"distinct","expected_behavior_key":"behavior.queued_send_burst_budget.legal_actor_turn_budget::activation.queued_send.actor_turn_with_legal_send","member_cell_ids":["cell.queued_send.00"]},{"equivalence_group_id":"equivalence.ebd0378da2462b87","equivalence_state":"distinct","expected_behavior_key":"behavior.queued_send_burst_budget.single_datagram_cap::activation.queued_send.legal_budget_gt_one","member_cell_ids":["cell.queued_send.01"]}],"expanded_planned_cells":[{"activation_signature_ids":["activation.queued_send.actor_turn_with_legal_send"],"axis_ids":["queued_send_burst_budget"],"cell_id":"cell.queued_send.00","cell_order":0,"equivalence_group_id":"equivalence.9076bb71363f2b6a","executable":true,"execution_state":"executable","expected_behavior_class_ids":["behavior.queued_send_burst_budget.legal_actor_turn_budget"],"non_behavior_outcome_ids":["outcome.clamped","outcome.error","outcome.fallback","outcome.inactive","outcome.invalid","outcome.unclassifiable"],"possible_effective_behavior_ids":["behavior.queued_send_burst_budget.legal_actor_turn_budget"],"primary_expected_behavior_ids":["behavior.queued_send_burst_budget.legal_actor_turn_budget"],"reason_codes":[],"treatment_ids":["treatment.queued_send_burst_budget.legacy_current"]},{"activation_signature_ids":["activation.queued_send.legal_budget_gt_one"],"axis_ids":["queued_send_burst_budget"],"cell_id":"cell.queued_send.01","cell_order":1,"equivalence_group_id":"equivalence.ebd0378da2462b87","executable":true,"execution_state":"executable","expected_behavior_class_ids":["behavior.queued_send_burst_budget.single_datagram_cap"],"non_behavior_outcome_ids":["outcome.clamped","outcome.error","outcome.fallback","outcome.inactive","outcome.invalid","outcome.unclassifiable"],"possible_effective_behavior_ids":["behavior.queued_send_burst_budget.legal_actor_turn_budget","behavior.queued_send_burst_budget.single_datagram_cap"],"primary_expected_behavior_ids":["behavior.queued_send_burst_budget.single_datagram_cap"],"reason_codes":[],"treatment_ids":["treatment.queued_send_burst_budget.single_datagram"]}],"notes":["Plan eligibility is distinct from runtime operation eligibility.","No runtime policy behavior or performance measurement is authorized by this result."],"performance_acceptance_authorization":false,"schema_version":"adaptive-runtime-experiment-plan-validation-v3","trace_references":{"architecture_ids":["ARC-QUIC-CRT-0092"],"requirement_ids":["REQ-QUIC-CRT-0202","REQ-QUIC-CRT-0203","REQ-QUIC-CRT-0204","REQ-QUIC-CRT-0205"],"verification_ids":["VER-QUIC-CRT-0094"],"work_item_ids":["WI-QUIC-CRT-0093"]},"validated_plan_ref":{"document_id":"adaptive_runtime_queued_send_actuation_plan_v1","schema_version":"adaptive-runtime-experiment-plan-v1","document_version":1,"content_sha256":"a33415277270991cb6c81d5ec9b762ac729627e1161df8437fa77ba592aa8262"},"validation_classification":"valid_actuation","validation_errors":[],"validation_id":"validation.experiment_plan.queued_send.actuation.v1.v3","validation_warnings":[{"message":"Performance measurement and performance acceptance remain unauthorized.","warning_code":"measurement_freeze_active"}]}